{
  "schema_version": "1.0.0",
  "review_id": "k5-pipa-2025-art15-review",
  "case_id": "pipa-2025-public-safety-basis",
  "input_manifest_sha256": "9e10a89bdace0e858965738727bf19d06418f55e21abd8043211a6dc2e328f19",
  "decision": "pass",
  "requested_decision": "pass",
  "decision_matches_request": true,
  "baseline_promotion_allowed": true,
  "review_model": "staged_self_review",
  "review_limitation": "포트폴리오 작성자가 단계별 역할을 분리해 재검수한 기록이며 독립된 제3자 검수 결과가 아니다.",
  "stage_count": 4,
  "check_summary": {
    "required": 9,
    "passed": 9,
    "revise": 0,
    "rejected": 0
  },
  "reject_reasons": [],
  "revise_reasons": [],
  "evidence_errors": [],
  "review_note": "현행 운영 코퍼스는 이미 신설 제7호를 포함한다. K5는 과거 버전을 운영 검색에 병합하지 않고, K4 사례의 검증 증거와 승인 가능 여부를 감사 기록으로 고정한다.",
  "release_actions": [
    "preserve_historical_fixture_separately",
    "retain_current_operational_corpus",
    "record_review_audit",
    "rerun_regression_before_future_baseline_change"
  ]
}
